tender_id,card_id,verdict,relevant,boilerplate_only_ai,info_has_real_ai,classification,relevance_score,product_category,customer,tender_name
"0139200000126000114","91679642","relevant_ai","true","true","","software_related","10","gov_regulatory_analytics","Управление государственного заказа Кемеровской области","Услуга системы поддержки принятия врачебных решений с применением технологий искусственного интеллекта"
"91681102","91681102","relevant_ai","true","true","","software_related","10","gov_regulatory_analytics","ДЕПАРТАМЕНТ ГОРОДА МОСКВЫ ПО КОНКУРЕНТНОЙ ПОЛИТИКЕ","Оказание услуг по интерпретации данных рентгенологических исследований с применением технологий искусственного интеллекта"
"91681104","91681104","relevant_ai","true","true","","software_related","10","medical_ai_support","ДЕПАРТАМЕНТ ГОРОДА МОСКВЫ ПО КОНКУРЕНТНОЙ ПОЛИТИКЕ","Оказание услуг по интерпретации данных рентгенологических исследований с применением технологий искусственного интеллекта"
"rq_0857200000326000002","91639770","relevant_ai","true","true","","software_related","10","medical_ai_support","Государственное казенное учреждение здравоохранения Псковско","Запрос цены. Оказание услуг по технической поддержке и сопровождению «Сервиса поддержки принятия врачебных решений с технологией и"
"rq_0372200278526000007","91639891","relevant_soft","true","false","","ai_core","9","software_services","Санкт-Петербургское государственное казенное учреждение ""Упр","Запрос цены. Оказание услуг по сопровождению автоматизированной системы «004» государственной информационной системы Санкт-Петербу"
"0373100029526000006","91621617","relevant_ai","true","false","","ai_core","9","medical_ai_support","государственное образовательное учреждение высшего профессио","Поставка размеченных датасетов для создания модели машинного обучения на токарном оборудовании, установленном на производственных "
"91595285","91595285","relevant_ai","true","true","","software_related","10","medical_ai_support","ООО ""КУЗБАСС-ТЕНДЕР""","Оказание услуг системы поддержки принятия врачебных решений с применением технологий искусственного интеллекта"
"91562449","91562449","relevant_ai","true","true","","software_related","10","medical_ai_support","МБЛПУ ""ГКБ № 1""","Оказание услуг системы поддержки принятия врачебных решений с применением технологий искусственного интеллекта"
"32615619725","91568034","relevant_ai","true","true","","software_related","10","enterprise_rag_llm_assistant","МУНИЦИПАЛЬНОЕ АВТОНОМНОЕ УЧРЕЖДЕНИЕ ""МЕДИАЦЕНТР""","Оказание услуг по предоставлению неисключительной лицензии на использование программного обеспечения для ведения пабликов в соцсет"
"0173100011226000001","91579267","relevant_soft","true","false","","ai_core","9","enterprise_rag_llm_assistant","Федеральная служба по финансовому мониторингу","Выполнение работ по развитию Единой информационной системы Федеральной службы по финансовому мониторингу"
"rq_0387300001426000012","91524550","relevant_ai","true","false","","ai_core","9","software_services","Муниципальное казенное учреждение ""Управление логистики""","Запрос цены. Оказание услуг по развитию и обеспечению функционирования нейронной сети помощи гражданам, официальных ресурсов орган"
"rq_0372200278526000003","91472317","relevant_soft","true","false","","ai_core","9","software_services","Санкт-Петербургское государственное казенное учреждение ""Упр","Запрос цены. Оказание услуг по сопровождению автоматизированной системы «004» государственной информационной системы Санкт-Петербу"
"91440403","91440403","relevant_soft","true","false","","ai_core","9","enterprise_rag_llm_assistant","Workspace","Корпоративная платформа управления знаниями"
"rq_0190200000325000029","91377683","relevant_ai","true","false","","ai_core","8","software_services","Департамент государственного заказа и торговли Ямало-Ненецко","Запрос цены. Оказание услуг по сопровождению интеграционного протокола обмена данными между ПО «СберТранспорт» и Сервисом предикти"
"32515582514","91368235","ambiguous","false","false","true","ai_core","9","analytics_monitoring","ГОСУДАРСТВЕННОЕ АВТОНОМНОЕ УЧРЕЖДЕНИЕ МОСКОВСКОЙ ОБЛАСТИ ""ДИ","Развитие и техническое сопровождение системы в рамках оказания услуг по реализации мероприятий в рамках проводимых центральными ис"
"0139200000125019123","91336424","relevant_ai","true","true","","software_related","10","gov_regulatory_analytics","Управление государственного заказа Кемеровской области","Оказание услуг по сопровождению системы поддержки принятия врачебных решений (СППВР) с применением технологий искусственного интел"
"0190200000325017243","91314185","relevant_ai","true","false","","ai_core","8","enterprise_rag_llm_assistant","Департамент государственного заказа и торговли Ямало-Ненецко","Выполнение работ по сопровождению и технической поддержке сервиса предиктивной аналитики"
"0373100029525000681","91270214","relevant_ai","true","false","","ai_core","17","analytics_monitoring","государственное образовательное учреждение высшего профессио","Оказание услуг по разработке модели машинного обучения для системы предиктивной аналитики поведения токарного оборудования, устано"
"0818500000825011179","91269052","relevant_ai","true","true","","software_related","10","medical_ai_support","ГОСУДАРСТВЕННОЕ КАЗЕННОЕ УЧРЕЖДЕНИЕ КРАСНОДАРСКОГО КРАЯ ""ДИР","Организация омниканального контактного центра по приему и обработке голосовых и неголосовых обращений с использованием голосовых р"
"0373100029525000684","91275989","relevant_ai","true","false","","ai_core","9","medical_ai_support","государственное образовательное учреждение высшего профессио","Поставка размеченных датасетов для создания модели машинного обучения на токарном оборудовании, установленном на производственных "
"91239622","91239622","relevant_soft","true","false","","automation_software","7","software_services","ОАО ""Уральская Сталь""","Оказание услуг по поддержке программных роботов в количестве двух по технологии RPA (роботы с процессами ""Статус обеспечения ремон"
"91194601","91194601","relevant_ai","true","false","","ai_core","18","software_services","Частное учреждение «Центр коммуникаций»","Выполнение работ по разработке программного комплекса автоматизированной проверки корректности использования логотипов организаций"
"rq_0113200003325000672","91192644","relevant_ai","true","true","","software_related","10","medical_ai_support","Министерство здравоохранения Удмуртской Республики","Запрос цены. Оказание услуг по техническому сопровождению программного обеспечения медицинского изделия с технологией искусственно"
"0139200000125018671","91199760","relevant_ai","true","true","","software_related","10","gov_regulatory_analytics","Управление государственного заказа Кемеровской области","Услуга системы поддержки принятия врачебных решений с применением технологий искусственного интеллекта"
"91187568","91187568","relevant_ai","true","false","","ai_core","18","software_services","Частное учреждение по реализации коммуникационных программ а","Выполнение работ по разработке программного комплекса автоматизированной проверки корректности использования логотипов организаций"
"91187968","91187968","relevant_ai","true","false","","ai_core","18","software_services","Частное учреждение по реализации коммуникационных программ а","Выполнение работ по разработке программного комплекса автоматизированной проверки корректности использования логотипов организаций"
"32515544865","91171784","relevant_ai","true","false","","ai_core","13","medical_ai_support","ГОСУДАРСТВЕННОЕ АВТОНОМНОЕ УЧРЕЖДЕНИЕ РЕСПУБЛИКИ САХА (ЯКУТИ","Оказание услуг по предоставлению простой (неисключительной) лицензии и внедрению программного обеспечения для видеоаналитики в ста"
"91162683","91162683","relevant_ai","true","true","","software_related","10","medical_ai_support","государственное бюджетное учреждение здравоохранения ""Беловс","Услуги системы поддержки принятия врачебных решений с применением технологий искусственного интеллекта"
"0846500000625000994","91180730","relevant_ai","true","true","","software_related","10","computer_vision","ОБЛАСТНОЕ КАЗЕННОЕ УЧРЕЖДЕНИЕ ""УПРАВЛЕНИЕ ПО РАЗМЕЩЕНИЮ ГОСЗ","Услуги по предоставлению доступа к Сервисам автоматического обслуживания абонентов с использованием технологии синтеза и распознав"
"91188656","91188656","ambiguous","false","false","false","ai_core","6","analytics_monitoring","ФОНД КАПИТАЛЬНОГО РЕМОНТА ОБЩЕГО ИМУЩЕСТВА В МНОГОКВАРТИРНЫХ","Оказание услуг по сопровождению подсистем информационно-аналитической системы для автоматизации деятельности регионального операто"
"91037223","91037223","relevant_soft","true","false","","automation_software","7","","","Поддержка Primo RPA Primo RPA"
"0841200000725002360","90985187","relevant_soft","true","true","","software_related","10","medical_ai_support","ОГКУ ""АГЗКО""","Оказание государственным медицинским организациям, расположенным на территории Костромской области, услуг по сопровождению государ"
"0373200234325000106","91001206","relevant_ai","true","true","","software_related","10","medical_ai_support","Государственное учреждение здравоохранения города Москвы ""На","Оказание услуг по интерпретации данных рентгенологических исследований с применением технологий искусственного интеллекта"
"90931504","90931504","relevant_ai","true","true","","software_related","10","medical_ai_support","ГОСУДАРСТВЕННОЕ КАЗЕННОЕ УЧРЕЖДЕНИЕ САРАТОВСКОЙ ОБЛАСТИ ""ГОС","Оказание услуг по обновлению, адаптации и сопровождению программного обеспечения медицинских изделий по описанию и интерпретации р"
"32515512927","90949637","relevant_soft","true","false","","automation_software","7","software_services","ОБЩЕСТВО С ОГРАНИЧЕННОЙ ОТВЕТСТВЕННОСТЬЮ ""ГАЗПРОМ МОБИЛЬНЫЕ ","Оказание услуг по консультационной и технической поддержке программных роботов на базе платформы Sherpa RPA"
"90895222","90895222","relevant_ai","true","false","","ai_core","15","computer_vision","Евразийский электронный портал","Лицензии на RPA с функцией распознавания документов"
"rq_0319200039725001579","90889634","relevant_ai","true","true","","ai_core","10","medical_ai_support","краевое государственное бюджетное учреждение здравоохранения","Запрос цены. оказание услуг по предоставлению простой (неисключительной) лицензии обеспечения видеоаналитики в медицинских учрежде"
"0373200234325000102","90923718","relevant_ai","true","true","","software_related","10","gov_regulatory_analytics","Государственное учреждение здравоохранения города Москвы ""На","Оказание услуг по интерпретация данных рентгенографических исследований органов грудной клетки с применением технологий искусствен"
"0373200234325000103","90923722","relevant_ai","true","true","","software_related","10","gov_regulatory_analytics","Государственное учреждение здравоохранения города Москвы ""На","Оказание услуг по интерпретации данных рентгенологических исследований с применением технологий искусственного интеллекта"
"0373200234325000104","90923723","relevant_ai","true","true","","software_related","10","gov_regulatory_analytics","Государственное учреждение здравоохранения города Москвы ""На","Оказание услуг по интерпретации данных рентгенологических исследований с применением технологий искусственного интеллекта"
"0373200234325000105","90923727","relevant_ai","true","true","","software_related","10","gov_regulatory_analytics","Государственное учреждение здравоохранения города Москвы ""На","Оказание услуг по интерпретации данных рентгенологических исследований с применением технологий искусственного интеллекта"
"0361200015025006910","90869247","relevant_ai","true","true","","software_related","10","medical_ai_support","Областное бюджетное учреждение ""Сахалинское агентство проект","Оказание услуг по технической поддержке и сопровождению Сервиса поддержки принятия врачебных решений с применением технологий иску"
"rq_0387300001425000286","90851895","relevant_ai","true","false","","ai_core","9","software_services","Муниципальное казенное учреждение ""Управление логистики""","Запрос цены. Оказание услуг по развитию и обеспечению функционирования нейронной сети помощи гражданам, официальных ресурсов орган"
"0818500000825010213","90845442","ambiguous","false","true","true","ai_core","10","medical_ai_support","ГОСУДАРСТВЕННОЕ КАЗЕННОЕ УЧРЕЖДЕНИЕ КРАСНОДАРСКОГО КРАЯ ""ДИР","Оказание услуг по сопровождению подсистемы ГИС СЗ КК ""Региональный архив медицинских изображений, результатов диагностических иссл"
"32515497089","90840943","relevant_soft","true","false","","automation_software","7","software_services","АКЦИОНЕРНОЕ ОБЩЕСТВО ""МОСОБЛГАЗ""","Поставка простой (неисключительной) лицензии PRIMO RPA"
"0848300045425001054","90708700","relevant_ai","true","true","","ai_core","10","analytics_monitoring","МУНИЦИПАЛЬНОЕ КАЗЕННОЕ УЧРЕЖДЕНИЕ ""ЦЕНТР МУНИЦИПАЛЬНЫХ ЗАКУП","Оказание услуг по сбору, обработке, контент-анализу информации и сопровождению модулей информационно-аналитической системы с испол"
"90672343","90672343","relevant_soft","true","false","","ai_core","27","medical_ai_support","Закупки Вологодской облости Электронный магазин","Предоставление лицензии на неисключительное право использования программного обеспечения СКЗИ «КриптоПро CSP» версии 5.0 бессрочна"
"90679662","90679662","relevant_ai","true","false","","ai_core","15","computer_vision","Евразийский электронный портал","Лицензии на RPA с функцией распознавания документов"
"90675252","90675252","relevant_soft","true","true","","software_related","10","software_services","Торговая Система «ТЭК-Торг»","Закупка серверного оборудования и системы хранения данных в рамках реализации мероприятия 23-2 «Создание цифровой платформы разраб"
"90680793","90680793","relevant_ai","true","false","","ai_core","8","computer_vision","Азиатско-Тихоокеанский Банк (ОАО)","Итоги Запроса котировок на предоставление простой (неисключительной) лицензии права использования, внедрение и техническую поддерж"
"0190200000325015669","90686030","relevant_ai","true","false","","ai_core","8","computer_vision","Департамент государственного заказа и торговли Ямало-Ненецко","Оказание услуг по предоставлению доступа к ПО для автоматизированного распознавания документов на условиях простой (неисключительн"
"90638426","90638426","relevant_soft","true","false","","automation_software","7","software_services","ОБЩЕСТВО С ОГРАНИЧЕННОЙ ОТВЕТСТВЕННОСТЬЮ ""Т2 МОБАЙЛ""","Предоставления прав использования программного обеспечения и оказания услуг технической поддержки ""Sherpa Robotics""."
"rq_0190200000325000028","90632753","relevant_ai","true","false","","ai_core","8","software_services","Департамент государственного заказа и торговли Ямало-Ненецко","Запрос цены. Выполнение работ по сопровождению и технической поддержке сервиса предиктивной аналитики"
"90592785","90592785","relevant_ai","true","false","","ai_core","8","computer_vision","ФЕДЕРАЛЬНАЯ СЛУЖБА ПО ФИНАНСОВОМУ МОНИТОРИНГУ","Оказание услуг по оснащению центрального аппарата Росфинмониторинга комплексом распознавания документов"
"0818500000825009521","90546973","relevant_ai","true","true","","software_related","10","computer_vision","ГОСУДАРСТВЕННОЕ КАЗЕННОЕ УЧРЕЖДЕНИЕ КРАСНОДАРСКОГО КРАЯ ""ДИР","Оказание услуг по сопровождению системы поддержки принятия врачебных решений с применением технологий искусственного интеллекта по"
"rq_0848600048325000004","90555270","relevant_ai","true","true","","ai_core","10","analytics_monitoring","МУНИЦИПАЛЬНОЕ КАЗЕННОЕ УЧРЕЖДЕНИЕ ""МУНИЦИПАЛЬНЫЙ ЦЕНТР УПРАВ","Запрос цены. Оказание услуг по сбору, обработке, контент-анализу информации и сопровождению модулей информационно-аналитической си"
"90547749","90547749","relevant_ai","true","false","","ai_core","8","","ЧУЗ ""КБ ""РЖД-Медицина"" г. Волгоград""","Программно-аппаратный комплекс для сканирования и распознавания документов"
"0128200000125007616","90510290","relevant_ai","true","true","","software_related","10","medical_ai_support","департамент имущественных и земельных отношений администраци","Оказание услуг по развитию программного обеспечения медицинского изделия с технологией искусственного интеллекта, применяющегося в"
"0361200015025006574","90531586","relevant_ai","true","true","","software_related","10","medical_ai_support","Областное бюджетное учреждение ""Сахалинское агентство проект","Оказание услуг по технической поддержке и сопровождению Сервиса поддержки принятия врачебных решений с применением технологий иску"
"90509181","90509181","relevant_soft","true","false","","automation_software","7","","ПАО ""КАМАЗ""","Лот № 45 Продление лицензий на программное обеспечение ""Primo RPA"""
"32515434333","90417111","relevant_ai","true","false","","ai_core","16","software_services","ГОСУДАРСТВЕННОЕ АВТОНОМНОЕ УЧРЕЖДЕНИЕ ГОРОДА МОСКВЫ ""МОСКОВС","Поставка программно-аппаратного комплекса для реализации алгоритмов машинного обучения и интеллектуального анализа данных"
