tender_id,card_id,verdict,relevant,boilerplate_only_ai,info_has_real_ai,classification,relevance_score,product_category,customer,tender_name
"0369300171425000005","88939822","relevant_ai","true","true","","software_related","10","computer_vision","муниципальное бюджетное учреждение ""Комплексный центр социал","Оказание услугу по предоставлению лицензии на право использовать компьютерное программное обеспечение для автоматизированной исход"
"88953193","88953193","relevant_ai","true","false","","ai_core","9","","ОАО Магнитогорский металлургический комбинат","Торги на РМ и комплектующие для ВТ компьютерного зрения"
"32515224869","88888214","relevant_ai","true","false","","ai_core","9","analytics_monitoring","АКЦИОНЕРНОЕ ОБЩЕСТВО ""ЮГО-ЗАПАДНАЯ ТЭЦ""","Оказание услуг по передаче неисключительных прав пользования и настройке программного обеспечения аппаратно-программного комплекса"
"0137200001225005799","88852239","relevant_ai","true","false","","ai_core","15","computer_vision","Министерство конкурентной политики и тарифов Калужской облас","Оказание услуг по разработке автоматизированного процесса на базе технологии распознавания документов (OCR) и технологии программи"
"rq_0372100047625000296","88870267","relevant_ai","true","true","","automation_software","10","medical_ai_support","Федеральное государственное бюджетное учреждение ""Санкт-Пете","Запрос цены. Выполнение работ по созданию автоматизированной системы «Интеграционная платформа для анализа компьютерной томографии"
"0190200000325011421","88851794","relevant_ai","true","false","","ai_core","8","computer_vision","Департамент государственного заказа и торговли Ямало-Ненецко","Выполнение работ по доработке (модернизации) сервиса предиктивной аналитики"
"rq_0148200001325000004","88805678","relevant_ai","true","true","","software_related","10","computer_vision","Главное контрольное управление Московской области","Запрос цены. Оказание услуг по распознаванию (обработке) электронных образов первичных учетных документов (электронных первичных у"
"32515214634","88807088","relevant_ai","true","false","","ai_core","9","software_services","ГОСУДАРСТВЕННОЕ БЮДЖЕТНОЕ УЧРЕЖДЕНИЕ МОСКОВСКОЙ ОБЛАСТИ ""МОС","Оказание услуг по предоставлению неисключительных прав (лицензии) на использование программного обеспечения для доступа в геоинфор"
"32515215912","88811789","relevant_ai","true","false","","ai_core","8","computer_vision","ГОСУДАРСТВЕННОЕ АВТОНОМНОЕ УЧРЕЖДЕНИЕ ЗДРАВООХРАНЕНИЯ ""НОВОК","Поставка программно-аппаратного комплекса сканирования и распознавания документов (среди субъектов малого и среднего предпринимате"
"88803385","88803385","relevant_ai","true","false","","ai_core","8","computer_vision","Публичное акционерное общество ""Ростелеком""","Выполнение работ по содержанию системы автоматической фотовидеофиксации нарушений Правил дорожного движения и распознавания изобра"
"88804627","88804627","relevant_ai","true","false","","ai_core","8","software_services","Евразийский электронный портал","Внедрение предиктивной аналитики с использованием ИИ"
"32515212472","88789322","relevant_ai","true","true","","ai_core","10","medical_ai_support","ГОСУДАРСТВЕННОЕ АВТОНОМНОЕ ПРОФЕССИОНАЛЬНОЕ ОБРАЗОВАТЕЛЬНОЕ ","Выполнение работ по разработке и внедрению чат-бота с применением технологий искусственного интеллекта для сайта Заказчика"
"rq_0373100094325001509","88775011","relevant_ai","true","false","","ai_core","9","medical_ai_support","Учреждение Российской академии медицинских наук Российский о","Запрос цены. Выполнение научно-исследовательской работы по выполнению части мероприятий по теме: «Разработка предиктивных моделей "
"rq_0373100094325001510","88775012","relevant_ai","true","false","","ai_core","9","medical_ai_support","Учреждение Российской академии медицинских наук Российский о","Запрос цены. Выполнение научно-исследовательской работы по выполнению части мероприятий по теме: «Разработка предиктивных моделей "
"rq_0190200000325000023","88720259","relevant_ai","true","false","","ai_core","17","software_services","Департамент государственного заказа и торговли Ямало-Ненецко","Запрос цены. Выполнение работ по доработке сервиса предиктивной аналитики в части определения весогабаритных размеров товара с пом"
"0101500000325000345","88725952","relevant_ai","true","false","","ai_core","8","computer_vision","ГОСУДАРСТВЕННЫЙ КОМИТЕТ РЕСПУБЛИКИ БАШКОРТОСТАН ПО МОНИТОРИН","Выполнение работ по содержанию системы автоматической фотовидеофиксации нарушений Правил дорожного движения и распознавания изобра"
"0818500000825006678","88710974","relevant_ai","true","true","","software_related","10","medical_ai_support","ГОСУДАРСТВЕННОЕ КАЗЕННОЕ УЧРЕЖДЕНИЕ КРАСНОДАРСКОГО КРАЯ ""ДИР","Организация омниканального контактного центра по приему и обработке голосовых и неголосовых обращений с использованием голосовых р"
"88684642","88684642","relevant_soft","true","false","","automation_software","7","software_services","Торговая Система «ТЭК-Торг»","Приобретение лицензий «PRIMO RPA»"
"88668650","88668650","relevant_soft","true","false","","automation_software","7","software_services","АКЦИОНЕРНОЕ ОБЩЕСТВО ""НОВОСИБИРСКЭНЕРГОСБЫТ""","Оказание услуг по разработке, адаптации, модификации программ для ЭВМ, баз данных [RPA]"
"0190200000325010992","88652541","relevant_ai","true","false","","ai_core","8","computer_vision","Департамент государственного заказа и торговли Ямало-Ненецко","Оказание услуг по технической поддержке модуля интеллектуального видеомониторинга, превентивного реагирования и предиктивной анали"
"rq_0348200049725000285","88632881","relevant_ai","true","false","","ai_core","9","software_services","Государственное казенное учреждение Московской области ""Упра","Запрос цены. оказание услуг по предоставлению неисключительных прав (лицензии) на использование программного обеспечения для досту"
"rq_0372100021625000257","88632021","relevant_ai","true","false","","ai_core","8","computer_vision","Федеральное государственное бюджетное учреждение ""Научно-исс","Запрос цены. Поставка программно-аппаратного комплекса для сканирования и распознавания документов (л/с 2711) в 2025 году"
"88630024","88630024","relevant_ai","true","false","","ai_core","8","software_services","Евразийский электронный портал","Внедрение предиктивной аналитики с использованием ИИ"
"rq_0848200000525000166","88606348","relevant_ai","true","true","","software_related","10","software_services","Государственное казенное учреждение Московской области ""Моск","Запрос цены. Поставка высокопроизводительной вычислительной платформы с использованием ускорителей искусственного интеллекта для в"
"rq_0373100094325001447","88607613","relevant_ai","true","false","","ai_core","9","medical_ai_support","Учреждение Российской академии медицинских наук Российский о","Запрос цены. Выполнение научно-исследовательской работы по выполнению части мероприятий по теме: «Разработка предиктивных моделей "
"rq_0373100094325001448","88607614","relevant_ai","true","false","","ai_core","9","medical_ai_support","Учреждение Российской академии медицинских наук Российский о","Запрос цены. Выполнение научно-исследовательской работы по выполнению части мероприятий по теме: «Разработка предиктивных моделей "
"88603049","88603049","relevant_ai","true","false","","ai_core","8","software_services","Евразийский электронный портал","Внедрение предиктивной аналитики с использованием ИИ"
"88562695","88562695","relevant_ai","true","false","","ai_core","9","computer_vision","ОБЩЕСТВО С ОГРАНИЧЕННОЙ ОТВЕТСТВЕННОСТЬЮ ""ТС ИНТЕГРАЦИЯ""","Предварительный отбор компаний, имеющих опыт выполнения работ по внедрению систем видеоаналитики на базе платформы компьютерного з"
"0173100008625000027","88590883","relevant_soft","true","false","","automation_software","7","gov_regulatory_analytics","Министерство экономического развития Российской Федерации","Услуги по технической поддержке и сопровождению платформы программных средств класса RPA"
"88550495","88550495","relevant_soft","true","false","","ai_core","8","computer_vision","ЭТП Закупки.ру","Внедрение платформы ЭДО"
"88551434","88551434","relevant_soft","true","false","","automation_software","7","software_services","Торговая Система «ТЭК-Торг»","Приобретение лицензий (подписки) на программное обеспечение роботизированной автоматизации процессов (Primo RPA) на 12 месяцев"
"88519611","88519611","relevant_soft","true","false","","ai_core","8","computer_vision","ЭТП Закупки.ру","Внедрение платформы ЭДО"
"32515170064","88477429","relevant_ai","true","true","","software_related","10","software_services","ФЕДЕРАЛЬНОЕ ГОСУДАРСТВЕННОЕ УНИТАРНОЕ ПРЕДПРИЯТИЕ ""ГЛАВНОЕ П","Предоставление на условиях простой (неисключительной) лицензии неисключительного права на использование программного обеспечения N"
"88469288","88469288","relevant_soft","true","false","","ai_core","8","computer_vision","ЭТП Закупки.ру","Внедрение платформы ЭДО"
"88409850","88409850","relevant_soft","true","false","","ai_core","8","computer_vision","ЭТП Закупки.ру","Внедрение платформы ЭДО"
"88404502","88404502","relevant_ai","true","false","","ai_core","8","software_services","Евразийский электронный портал","Внедрение предиктивной аналитики с использованием ИИ"
"32515152886","88363764","relevant_ai","true","true","","software_related","10","medical_ai_support","ФЕДЕРАЛЬНОЕ ГОСУДАРСТВЕННОЕ БЮДЖЕТНОЕ УЧРЕЖДЕНИЕ ""НАЦИОНАЛЬН","Разработке прототипа программного обеспечения с применение технологий искусственного интеллекта для выявления объемных образований"
"88377652","88377652","relevant_ai","true","false","","ai_core","8","computer_vision","БАНК РОССИИ","Запрос обязательства о неразглашении (NDA) для участия в анализе рынка с целью определения стоимости выполнения работ по созданию "
"32515150113","88336814","relevant_soft","true","false","","automation_software","7","process_automation","АКЦИОНЕРНОЕ ОБЩЕСТВО ""НОВОСИБИРСКЭНЕРГОСБЫТ""","Выполнение работ по настройке и доработке роботов PIX RPA с целью роботизации бизнес-процесса по работе с судебными приказами"
"88312123","88312123","relevant_ai","true","false","","ai_core","9","computer_vision","Публичное акционерное общество ""Ростелеком""","Оказание услуг по сервисному и техническому обслуживанию автоматизированных комплексов видеофиксации нарушений, использующих интел"
"rq_0148200001325000001","88298416","relevant_ai","true","true","","software_related","10","computer_vision","Главное контрольное управление Московской области","Запрос цены. Оказание услуг по распознаванию (обработке) электронных образов первичных учетных документов (электронных первичных у"
"88296826","88296826","relevant_ai","true","false","","ai_core","9","software_services","Коммерческие тендеры МТС","216012. Запрос сведений (RFI) с целью определения потенциального круга поставщиков решения разработки системы на базе инструментов"
"rq_0373100094325001376","88298626","relevant_ai","true","false","","ai_core","9","medical_ai_support","Учреждение Российской академии медицинских наук Российский о","Запрос цены. Научно-исследовательская работа по выполнению части мероприятий по теме: «Разработка предиктивных моделей на основе и"
"rq_0373100094325001377","88298631","relevant_ai","true","false","","ai_core","9","medical_ai_support","Учреждение Российской академии медицинских наук Российский о","Запрос цены. Научно-исследовательская работа по выполнению части мероприятий по теме: «Разработка предиктивных моделей на основе и"
"32515138740","88256644","relevant_ai","true","false","","ai_core","19","software_services","ФЕДЕРАЛЬНОЕ ГОСУДАРСТВЕННОЕ АВТОНОМНОЕ УЧРЕЖДЕНИЕ ""ЦИФРОВЫЕ ","Выполнение работ по созданию информационной системы «Облачная платформа, специализированная для обучения и эффективного запуска мо"
"0173200024025000082","88259742","relevant_ai","true","true","","software_related","10","gov_regulatory_analytics","Департамент градостроительной политики города Москвы","Разработка, тестирование и оптимизация комплекса технологий искусственного интеллекта и методов математического моделирования для "
"88261796","88261796","relevant_ai","true","true","","software_related","10","gov_regulatory_analytics","ДЕПАРТАМЕНТ ГРАДОСТРОИТЕЛЬНОЙ ПОЛИТИКИ ГОРОДА МОСКВЫ","Разработка, тестирование и оптимизация комплекса технологий искусственного интеллекта и методов математического моделирования для "
"88273113","88273113","relevant_ai","true","true","","software_related","10","medical_ai_support","Торговая Система «ТЭК-Торг»","Оказание услуги по предоставлению сертификата технической поддержки медицинского изделия по описанию и интерпретации рентгенологич"
"32515141840","88275754","relevant_ai","true","true","","software_related","10","medical_ai_support","ГОСУДАРСТВЕННОЕ АВТОНОМНОЕ УЧРЕЖДЕНИЕ ЗДРАВООХРАНЕНИЯ ""МЕДИЦ","Оказание услуги по предоставлению сертификата технической поддержки медицинского изделия по описанию и интерпретации рентгенологич"
"88266934","88266934","relevant_ai","true","false","","ai_core","8","computer_vision","","Внедрение станции распознавания документов"
"0148200002425000015","88241263","relevant_ai","true","false","","ai_core","9","medical_ai_support","Министерство информационных технологий и связи Московской об","Оказание услуг по передаче прав использования на условиях простой (неисключительной) лицензии на программное обеспечение большой я"
"88214724","88214724","relevant_ai","true","true","","software_related","10","computer_vision","МУНИЦИПАЛЬНОЕ БЮДЖЕТНОЕ УЧРЕЖДЕНИЕ ""КОМПЛЕКСНЫЙ ЦЕНТР СОЦИАЛ","Оказание услуги по предоставлению лицензии на право использовать компьютерное программное обеспечение для внедрения автоматизирова"
"rq_0160200005725000373","88210890","relevant_ai","true","true","","software_related","10","medical_ai_support","министерство здравоохранения Саратовской области","Запрос цены. Оказание услуг по обновлению, адаптации и сопровождению программного обеспечения медицинских изделий по описанию и ин"
"rq_0190200002125000093","88210051","relevant_ai","true","false","","ai_core","8","computer_vision","ДИТиС ЯНАО","Запрос цены. Оказание услуг по технической поддержке модуля интеллектуального видеомониторинга, превентивного реагирования и преди"
"32515126008","88155418","relevant_ai","true","false","","automation_software","16","software_services","АКЦИОНЕРНОЕ ОБЩЕСТВО ""КАВМИНКУРОРТРЕСУРСЫ""","Конкурс в электронной форме, участниками которого могут быть только субъекты малого и среднего предпринимательства, на право заклю"
"32515130568","88184010","relevant_soft","true","false","","automation_software","7","software_services","ФЕДЕРАЛЬНОЕ ГОСУДАРСТВЕННОЕ УНИТАРНОЕ ПРЕДПРИЯТИЕ ""ИНФОРМАЦИ","Предоставление права использования программного обеспечения PIX RPA (PIX Robot + PIX Studio) на условиях простой (неисключительной"
"0369300245925000005","88096996","relevant_ai","true","true","","software_related","10","gov_regulatory_analytics","Муниципальное учреждение ""Комплексный центр социального обсл","Услуга по предоставлению лицензии на право использовать компьютерное программное обеспечение для внедрения автоматизированной исхо"
"0369300245925000006","88097019","relevant_ai","true","true","","software_related","10","computer_vision","Муниципальное учреждение ""Комплексный центр социального обсл","Услуга по предоставлению лицензии на право использовать компьютерное программное обеспечение для внедрения автоматизированной исхо"
"88051956","88051956","relevant_ai","true","false","","ai_core","9","software_services","ООО ""АЛАБУГА-ВОЛОКНО""","Оказание услуги по сопровождению сервиса промышленного компьютерного зрения на базе программного обеспечения «ML Sense» для нужд О"
"rq_0848500003825000013","88050139","relevant_ai","true","false","","ai_core","9","computer_vision","ГОСУДАРСТВЕННОЕ КАЗЕННОЕ УЧРЕЖДЕНИЕ МОСКОВСКОЙ ОБЛАСТИ ""ДИРЕ","Запрос цены. Оказание услуг по сервисному и техническому обслуживанию автоматизированных комплексов видеофиксации нарушений, испол"
"88051734","88051734","relevant_ai","true","false","","ai_core","7","software_services","ЭТП Закупки.ру","Техническая поддержка программной платформы сбора, интеллектуального анализа данных и управления процессами ""MONQ""."
"rq_0367200006825000177","88028048","relevant_ai","true","true","","software_related","10","medical_ai_support","ГКУ ТО ""ЦИТТО""","Запрос цены. оказание услуг по сопровождению программного обеспечения медицинского изделия с технологией искусственного интеллекта"
"rq_0173100008625000080","88027363","relevant_soft","true","false","","automation_software","7","software_services","Министерство экономического развития Российской Федерации","Запрос цены. Оказание услуг по технической поддержке и сопровождению платформы программных средств класса RPA"
"rq_0318200028125001179","88002160","relevant_ai","true","true","","software_related","10","medical_ai_support","государственное бюджетное учреждение здравоохранения ""Детска","Запрос цены. Организация омниканального контактного центра по приему и обработке голосовых и неголосовых обращений с использование"
