tender_id,card_id,verdict,relevant,boilerplate_only_ai,info_has_real_ai,classification,relevance_score,product_category,customer,tender_name
"93505167","93505167","relevant_ai","true","true","","ai_core","10","medical_ai_support","МАУЗ ""ХИМКИНСКАЯ ЦЕНТРАЛЬНАЯ КЛИНИЧЕСКАЯ БОЛЬНИЦА""","Оказание услуг по активации специализированного программного обеспечения Fotofinder universe и Moleanalyzer PRO с сервисом искусст"
"93505849","93505849","relevant_ai","true","true","","ai_core","10","medical_ai_support","ГОСУДАРСТВЕННОЕ БЮДЖЕТНОЕ УЧРЕЖДЕНИЕ ЗДРАВООХРАНЕНИЯ МОСКОВС","Оказание услуг по активации специализированного программного обеспечения Fotofinder universe и Moleanalyzer PRO с сервисом искусст"
"93516901","93516901","relevant_ai","true","true","","ai_core","10","ai_software_services","ГКОУ ""Специальная (коррекционная) общеобразовательная школа ","Образовательные услуги по повышению квалификации путем организации и проведения образовательных мероприятий по теме: «Искусственны"
"rq_0371200021026000023","93456609","relevant_ai","true","true","","ai_core","20","medical_ai_support","государственное бюджетное учреждение Ярославской области ""Эл","Запрос цены. Оказание услуг по предоставлению сертификата на сопровождение в региональном сегменте единой государственной информац"
"93481928","93481928","relevant_ai","true","true","","ai_core","20","software_services","ООО ""МАШИНОСТРОЕНИЕ""","Разработка модуля системы IVA, предназначенного для автоматического формирования протоколов совещаний на основе технологий искусст"
"0372100005626000016","93481608","relevant_soft","true","true","","ai_core","10","gov_regulatory_analytics","федеральное государственное бюджетное учреждение культуры ""Г","Оказание услуг по сопровождению системы КАМИС 5, мультимедийных систем, комплексов и приложений, СПД «Портал Виртуальная академия»"
"32615887656","93484794","relevant_soft","true","false","","automation_software","7","software_services","ПУБЛИЧНОЕ АКЦИОНЕРНОЕ ОБЩЕСТВО ""Т ПЛЮС""","Выполнение работ по развитию Корпоративной информационной системы ""Т+ Роботизация""(КИС ""Т+ Роботизация) в части разработки програм"
"rq_0356500001726000019","93387835","relevant_ai","true","true","","ai_core","20","medical_ai_support","ГОСУДАРСТВЕННОЕ БЮДЖЕТНОЕ УЧРЕЖДЕНИЕ ПЕРМСКОГО КРАЯ ""ЦЕНТР И","Запрос цены. Оказание услуг по сопровождению и эксплуатации Модуля поддержки принятия врачебных решений с технологией искусственно"
"0801500001126000557","93393730","relevant_soft","true","true","","ai_core","10","software_services","ГОСУДАРСТВЕННОЕ КАЗЕННОЕ УЧРЕЖДЕНИЕ РЕСПУБЛИКИ БАШКОРТОСТАН ","Создание и поставка программно-аппаратных комплексов и интерактивной виртуальной примерочной в рамках приобретения оборудования и "
"0826500000926000868","93317104","relevant_ai","true","true","","ai_core","20","medical_ai_support","ОБЛАСТНОЕ ГОСУДАРСТВЕННОЕ КАЗЕННОЕ УЧРЕЖДЕНИЕ БЕЛГОРОДСКОЙ О","Оказание услуг по сопровождению системы поддержки принятия врачебных решений (СППВР) с применением технологий искусственного интел"
"rq_0372100047626000146","93301345","relevant_ai","true","true","","automation_software","20","medical_ai_support","Федеральное государственное бюджетное учреждение ""Санкт-Пете","Запрос цены. Выполнение работ по созданию Комплекса инструментов для автоматизированной системы «Интеграционная платформа для анал"
"93304778","93304778","relevant_soft","true","true","","ai_core","10","software_services","","Услуги по продлению неисключительных прав (лицензии) на программное обеспечение ""Контур.Фокус"""
"0172200002526000102","93263957","relevant_ai","true","true","","ai_core","10","software_services","Комитет по государственному заказу Санкт-Петербурга","Поставка высокопроизводительной вычислительной платформы с использованием ускорителей искусственного интеллекта"
"32615855031","93244848","relevant_soft","true","false","","automation_software","7","software_services","АКЦИОНЕРНОЕ ОБЩЕСТВО ""АГЕНТСТВО ТЕРРИТОРИАЛЬНОГО РАЗВИТИЯ ЗА","Работы по роботизации бизнес процесса"
"93227936","93227936","relevant_ai","true","true","","ai_core","20","medical_ai_support","ГКУ ""ЗАБГОСЗАКУП""","Приобретение услуг по организации омниканального контактного центра по приему и обработке голосовых и неголосовых обращений с испо"
"rq_0200400003926000093","93225979","relevant_ai","true","false","","ai_core","19","software_services","ПУБЛИЧНО-ПРАВОВАЯ КОМПАНИЯ ""РОСКАДАСТР""","Запрос цены. Выполнение работ по развитию Модульной системы для машинного обучения Подсистемы искусственного интеллекта федерально"
"32615847668","93206251","relevant_ai","true","true","","ai_core","20","medical_ai_support","ГОСУДАРСТВЕННОЕ АВТОНОМНОЕ УЧРЕЖДЕНИЕ ЗДРАВООХРАНЕНИЯ ""ЗАБАЙ","Приобретение услуг по организации омниканального контактного центра по приему и обработке голосовых и неголосовых обращений с испо"
"0358100020726000005","93172648","relevant_soft","true","true","","ai_core","10","software_services","государственное бюджетное образовательное учреждение среднег","Поставка оборудования (настольный программно-аппаратный комплекс голографической визуализации)"
"rq_0200400003926000089","93120889","relevant_ai","true","false","","ai_core","19","software_services","ПУБЛИЧНО-ПРАВОВАЯ КОМПАНИЯ ""РОСКАДАСТР""","Запрос цены. Выполнение работ по развитию Модульной системы для машинного обучения Подсистемы искусственного интеллекта федерально"
"93075880","93075880","relevant_ai","true","false","","ai_core","9","enterprise_rag_llm_assistant","МУНИЦИПАЛЬНОЕ КАЗЕННОЕ УЧРЕЖДЕНИЕ ""УПРАВЛЕНИЕ ПО ОБЕСПЕЧЕНИЮ","Оказание услуг по предоставлению неисключительных прав на систему «Сайбокс» «Цифровой ассистент на базе больших языковых моделей» "
"93077519","93077519","relevant_ai","true","false","","ai_core","9","enterprise_rag_llm_assistant","МУНИЦИПАЛЬНОЕ КАЗЕННОЕ УЧРЕЖДЕНИЕ ""УПРАВЛЕНИЕ ПО ОБЕСПЕЧЕНИЮ","Оказание услуг по предоставлению неисключительных прав на систему «Сайбокс» «Цифровой ассистент на базе больших языковых моделей» "
"rq_0372200192226000007","93047234","relevant_soft","true","true","","ai_core","10","analytics_monitoring","Санкт-Петербургское государственное бюджетное учреждение ""Це","Запрос цены. оказание услуг по сопровождению государственной информационной системы «Транспортная модель Санкт-Петербурга» в 2026 "
"0869200000226002138","93001700","relevant_ai","true","true","","ai_core","20","computer_vision","Государственное казенное учреждение Челябинской области ""Цен","На оказание Услуг по передаче сертификата на сопровождение системы поддержки принятия врачебных решений (СППВР) с применением техн"
"32615819197","93008463","relevant_ai","true","false","","ai_core","19","software_services","ФЕДЕРАЛЬНОЕ ГОСУДАРСТВЕННОЕ УНИТАРНОЕ ПРЕДПРИЯТИЕ ""РОСМОРПОР","Аукцион в электронной форме (№ ЦА 04-26), участниками которого могут быть только субъекты малого и среднего предпринимательства, п"
"rq_0200400003926000083","93012916","relevant_ai","true","false","","ai_core","19","software_services","ПУБЛИЧНО-ПРАВОВАЯ КОМПАНИЯ ""РОСКАДАСТР""","Запрос цены. Выполнение работ по развитию Модульной системы для машинного обучения Подсистемы искусственного интеллекта федерально"
"92942272","92942272","relevant_ai","true","true","","ai_core","10","","","""Выполнение работ по разработке программных продуктов, информационных систем и/или доработке их функциональности"" ""Выполнение рабо"
"92948634","92948634","relevant_ai","true","true","","ai_core","10","software_services","АО ""ТАИФ""","Поставка одного стоечного GPU-сервера с процессором Dual AMD EPYC 9005/9004 Series Processors или аналог Intel Xeon Gold и серверн"
"92952023","92952023","ambiguous","false","false","true","ai_core","9","software_services","Группа Компаний «ФосАгро»","Разработка программных продуктов, информ. систем и/или их доработки АО""Апатит"""
"32615813504","92949213","relevant_soft","true","false","","automation_software","7","software_services","ФЕДЕРАЛЬНОЕ ГОСУДАРСТВЕННОЕ УНИТАРНОЕ ПРЕДПРИЯТИЕ ""ГЛАВНОЕ П","Роботизация процесса «Проверка Госпочты» на платформе PIX RPA для нужд ГлавУпДК при МИД России"
"92926144","92926144","relevant_soft","true","false","","ai_core","42","medical_ai_support","Закупки Вологодской облости Электронный магазин","Оказание услуг по передаче права на использование простой (неисключительной )лицензии на программное обеспечение ViPNet Client 5.0"
"92925595","92925595","relevant_ai","true","true","","ai_core","20","medical_ai_support","ГАУЗ ПГБ","Оказание услуг системы поддержки принятия врачебных решений с применением технологий искусственного интеллекта"
"0328100007326000008","92894396","relevant_ai","true","true","","ai_core","20","analytics_monitoring","ФЕДЕРАЛЬНОЕ ГОСУДАРСТВЕННОЕ БЮДЖЕТНОЕ УЧРЕЖДЕНИЕ ""НАЦИОНАЛЬН","«Оказание услуг системы управления и дистанционного мониторинга с автоматическим определением лесных пожаров, основанная на технол"
"0372100047626000046","92903392","relevant_ai","true","true","","automation_software","20","medical_ai_support","Федеральное государственное бюджетное учреждение ""Санкт-Пете","Выполнение работ по созданию Комплекса инструментов для автоматизированной системы «Интеграционная платформа для анализа компьютер"
"0328100007326000008","92894396","relevant_ai","true","true","","ai_core","20","analytics_monitoring","ФЕДЕРАЛЬНОЕ ГОСУДАРСТВЕННОЕ БЮДЖЕТНОЕ УЧРЕЖДЕНИЕ ""НАЦИОНАЛЬН","«Оказание услуг системы управления и дистанционного мониторинга с автоматическим определением лесных пожаров, основанная на технол"
"rq_0372200286926000002","92886147","relevant_ai","true","true","","ai_core","10","software_services","СПб ГБУ ""ИМЦ""","Запрос цены. Поставка высокопроизводительной вычислительной платформы с использованием ускорителей искусственного интеллекта"
"0843500000226001169","92896676","relevant_ai","true","true","","ai_core","10","software_services","ГОСУДАРСТВЕННОЕ КАЗЕННОЕ УЧРЕЖДЕНИЕ ""УПРАВЛЕНИЕ ГОСУДАРСТВЕН","Оказание услуги на поставку программно-аппаратного комплекса - высокопроизводительной вычислительной платформы с использованием ус"
"32615804273","92900994","relevant_ai","true","true","","ai_core","10","software_services","ГОСУДАРСТВЕННОЕ АВТОНОМНОЕ УЧРЕЖДЕНИЕ КАЛУЖСКОЙ ОБЛАСТИ ""ЦЕН","Оказание услуг по разработке и внедрению сервиса искусственного интеллекта, консультирующего по вопросам деятельности в сфере физи"
"32615802998","92884641","relevant_ai","true","false","","ai_core","9","software_services","ФЕДЕРАЛЬНОЕ ГОСУДАРСТВЕННОЕ АВТОНОМНОЕ УЧРЕЖДЕНИЕ ""ЦИФРОВЫЕ ","Выполнение работ по развитию информационной системы «Реестр отраслевых моделей машинного обучения и наборов данных»"
"92885431","92885431","relevant_ai","true","false","","ai_core","9","enterprise_rag_llm_assistant","МУНИЦИПАЛЬНОЕ КАЗЕННОЕ УЧРЕЖДЕНИЕ ""УПРАВЛЕНИЕ ПО ОБЕСПЕЧЕНИЮ","Оказание услуг по предоставлению неисключительных прав на систему «Сайбокс» «Цифровой ассистент на базе больших языковых моделей» "
"32615798391","92861052","relevant_ai","true","true","","ai_core","20","medical_ai_support","ГОСУДАРСТВЕННОЕ АВТОНОМНОЕ УЧРЕЖДЕНИЕ ЗДРАВООХРАНЕНИЯ ""ЗАБАЙ","Приобретение услуг по организации омниканального контактного центра по приему и обработке голосовых и неголосовых обращений с испо"
"0108500000426001281","92862878","relevant_ai","true","true","","ai_core","20","medical_ai_support","КОМИТЕТ ПО РЕГУЛИРОВАНИЮ КОНТРАКТНОЙ СИСТЕМЫ В СФЕРЕ ЗАКУПОК","Оказание услуг по техническому сопровождению подсистемы ""Электронная медицинская карта"" Государственной информационной системы в с"
"0105500000226000442","92877447","relevant_ai","true","true","","ai_core","20","medical_ai_support","СЛУЖБА РЕГУЛИРОВАНИЯ КОНТРАКТНОЙ СИСТЕМЫ В СФЕРЕ ЗАКУПОК РЕС","Оказание услуг по техническому сопровождению медицинского изделия с технологией искусственного интеллекта программное обеспечение "
"92854099","92854099","relevant_ai","true","true","","ai_core","10","software_services","ОАО «Метафракс»","Проектирование размещения оборудования и разработке программного обеспечения с применением искусственного интеллекта для выполнени"
"92865143","92865143","relevant_ai","true","false","","ai_core","9","enterprise_rag_llm_assistant","МУНИЦИПАЛЬНОЕ КАЗЕННОЕ УЧРЕЖДЕНИЕ ""УПРАВЛЕНИЕ ПО ОБЕСПЕЧЕНИЮ","Оказание услуг по предоставлению неисключительных прав на систему «Сайбокс» «Цифровой ассистент на базе больших языковых моделей» "
"0171200001926000746","92850672","relevant_ai","true","true","","ai_core","20","medical_ai_support","департамент государственного заказа Ярославской области","Оказание услуг по сопровождению в региональном сегменте единой государственной информационной системы здравоохранения Ярославской "
"92801309","92801309","relevant_ai","true","true","","ai_core","20","computer_vision","Торговая Система «ТЭК-Торг»","Оказание услуг по установке и обслуживанию аппаратно-программных средств с применением технологий искусственного интеллекта для тр"
"92814618","92814618","relevant_ai","true","true","","ai_core","10","","","Проектирование размещения оборудования и разработке программного обеспечения с применением искусственного интеллекта для выполнени"
"0145300009626000076","92823934","relevant_soft","true","false","","automation_software","8","software_services","Администрация муниципального образования Тихвинский муниципа","Приобретение и внедрение программного обеспечения для автоматизации процесса административного воздействия по пресечению нарушений"
"92765894","92765894","relevant_ai","true","true","","ai_core","20","analytics_monitoring","ФЕДЕРАЛЬНОЕ ГОСУДАРСТВЕННОЕ БЮДЖЕТНОЕ УЧРЕЖДЕНИЕ ""НАЦИОНАЛЬН","«Оказание услуг системы управления и дистанционного мониторинга с автоматическим определением лесных пожаров, основанная на технол"
"92759116","92759116","relevant_soft","true","true","","ai_core","10","software_services","СЧЕТНАЯ ПАЛАТА ХАНТЫ-МАНСИЙСКОГО АВТОНОМНОГО ОКРУГА - ЮГРЫ","Услуги по предоставлению неисключительных прав (лицензии) на программное обеспечение (VK WorkMail)"
"92729144","92729144","relevant_ai","true","true","","ai_core","10","ai_software_services","БАНК РОССИИ","Оказание образовательных (консультационных) услуг по теме «Искусственный интеллект в банковской сфере»"
"rq_0372200192226000006","92734865","relevant_soft","true","true","","ai_core","10","analytics_monitoring","Санкт-Петербургское государственное бюджетное учреждение ""Це","Запрос цены. Оказание услуг по сопровождению государственной информационной системы «Транспортная модель Санкт-Петербурга» в 2026 "
"0811500001126000010","92725550","relevant_ai","true","false","","ai_core","9","software_services","ГОСУДАРСТВЕННОЕ КАЗЕННОЕ УЧРЕЖДЕНИЕ ""ЦЕНТР ЦИФРОВОЙ ТРАНСФОР","Модернизация информационной системы анализа видеопотока в целях обеспечения ее машинного обучения"
"0328100007326000006","92720027","relevant_ai","true","true","","ai_core","20","analytics_monitoring","Федеральное государственное бюджетное учреждение ""Национальн","«Оказание услуг системы управления и дистанционного мониторинга с автоматическим определением лесных пожаров, основанная на технол"
"92708087","92708087","relevant_ai","true","true","","ai_core","10","software_services","МИНЭНЕРГО РОССИИ","Оказание услуг по организации трансляции семинара «Роль ТЭК в развитии искусственного интеллекта» в сеть Интернет"
"0869200000226001639","92674938","relevant_ai","true","true","","ai_core","20","medical_ai_support","Государственное казенное учреждение Челябинской области ""Цен","На оказание Услуг по технической поддержке и сопровождению ""Сервиса поддержки принятия врачебных решений с технологией искусственн"
"92690732","92690732","relevant_ai","true","true","","ai_core","10","software_services","","Оказание информационно-консультационных, организационных услуг, а именно: услуги по организации, проведению и сопровождению страте"
"0187300015626000007","92687116","relevant_ai","true","false","","ai_core","9","software_services","Администрация города Ханты-Мансийска","Оказание услуг по развитию и обеспечению функционирования нейронной сети помощи гражданам, официальных ресурсов органов местного с"
"92671410","92671410","relevant_soft","true","false","","automation_software","7","software_services","Евразийский электронный портал","Услуги по продлению лицензии на право использования программного обеспечения ЛПО RPA"
"92660267","92660267","relevant_ai","true","true","","ai_core","20","","","Голосовые роботы, а также лицензии на использование интеллектуальных агентов на базе технологий искусственного интеллекта (LLM-аге"
"0321300184826000051","92659047","relevant_ai","true","false","","automation_software","23","medical_ai_support","ГБУЗ СК ""Городская поликлиника № 1"" г. Пятигорска","Оказание услуг по передаче на условиях простой (неисключительной) лицензии прав пользования программным обеспечением системы подде"
"92649168","92649168","relevant_ai","true","true","","ai_core","20","enterprise_rag_llm_assistant","ООО ""КЕХ ЕКОММЕРЦ""","Голосовые роботы, а также лицензии на использование интеллектуальных агентов на базе технологий искусственного интеллекта (LLM-аге"
